{
  "$schema": "https://json-schema.org/draft/2020-12/schema",
  "title": "skill_manifest",
  "type": "object",
  "required": [
    "skill_id",
    "name",
    "description_zh",
    "description_en",
    "triggers",
    "pack_ids",
    "related_skills",
    "scope_in",
    "scope_out"
  ],
  "properties": {
    "skill_id": { "type": "string" },
    "name": { "type": "string" },
    "description_zh": { "type": "string" },
    "description_en": { "type": "string" },
    "triggers": { "type": "array", "items": { "type": "string" } },
    "pack_ids": { "type": "array", "items": { "type": "string" } },
    "related_skills": { "type": "array", "items": { "type": "string" } },
    "scope_in": { "type": "array", "items": { "type": "string" } },
    "scope_out": { "type": "array", "items": { "type": "string" } }
  }
}
